{
  "schemaVersion": 1,
  "fixtureId": "demo-v1",
  "anchorTime": "2026-10-12T09:00:00+09:00",
  "timezone": "Asia/Seoul",
  "locale": "ko_KR",
  "appCommit": null,
  "captures": [
    {
      "id": "workout-ready",
      "status": "pending",
      "width": 834,
      "height": 1194,
      "textScale": "standard"
    },
    {
      "id": "workout-active",
      "status": "pending",
      "width": 834,
      "height": 1194,
      "textScale": "standard"
    },
    {
      "id": "workout-rest",
      "status": "pending",
      "width": 834,
      "height": 1194,
      "textScale": "standard"
    },
    {
      "id": "plan-month",
      "status": "pending",
      "width": 834,
      "height": 1194,
      "textScale": "standard"
    },
    {
      "id": "plan-date-detail",
      "status": "pending",
      "width": 834,
      "height": 1194,
      "textScale": "standard"
    },
    {
      "id": "records-overview",
      "status": "pending",
      "width": 834,
      "height": 1194,
      "textScale": "standard"
    },
    {
      "id": "journal-calendar",
      "status": "pending",
      "width": 834,
      "height": 1194,
      "textScale": "standard"
    },
    {
      "id": "journal-entry",
      "status": "pending",
      "width": 834,
      "height": 1194,
      "textScale": "standard"
    },
    {
      "id": "friends-home",
      "status": "pending",
      "width": 834,
      "height": 1194,
      "textScale": "standard"
    },
    {
      "id": "friends-ranking",
      "status": "pending",
      "width": 834,
      "height": 1194,
      "textScale": "standard"
    }
  ]
}
